{"type":"panel","id":"column","name":"Form","configs":{"uid":"fio-125","key":"form"},"children":[{"type":"panel","id":"group","name":"GUIDE","configs":{"uid":"fio-1","key":"guide","label":"GUIDE"},"children":[{"type":"panel","id":"row","name":"Row","configs":{"uid":"fio-2","key":"columns17"},"children":[{"type":"panel","id":"column","name":"Column","configs":{"uid":"fio-3","key":"fio-4"},"children":[{"type":"panel","id":"group","name":"Type de demande ","configs":{"uid":"fio-5","key":"veuillez_faire_un_choix","label":"Type de demande "},"children":[{"type":"input","dataType":"string","id":"text","name":"Text","configs":{"uid":"fio-6","key":"type_de_demandeur","label":"Type de demandeur","description":"Le type de demandeur est défini automatiquement en fonction des informations de votre compte et ne peut pas être modifié.","defaultValue":"Personne physique","disabled":true},"validations":[{"validator":"required"}]},{"type":"input","dataType":"string","id":"radio","name":"Radio","configs":{"uid":"fio-7","key":"structure","label":"Structure","defaultValue":"Groupes de citoyens","optionsSource":"static","options":"Groupes de citoyens\nAssociations\nONG\nÉcole"},"validations":[{"validator":"required"}]}]}]},{"type":"panel","id":"column","name":"Column","configs":{"uid":"fio-8","key":"fio-9"},"children":[{"type":"panel","id":"group","name":"Informations du service","configs":{"uid":"fio-10","key":"informationsDuService","label":"Informations du service"},"children":[{"type":"output","dataType":"void","id":"content","name":"Content","configs":{"uid":"fio-11","key":"content","content":"<p>Le laissez-passer collectif, délivré par le MSPC, autorise un groupe<strong> à franchir légalement une frontière.</strong></p><p>Il faut être majeur, avoir un motif légitime et respecter les règles de sécurité. Les pièces requises : le paiement de <strong>500 F CFA en ligne pour le timbre fiscal</strong>, la liste des participants avec l’immatriculation du véhicule, l’assurance et le permis du chauffeur.</p><p>Pour un voyage scolaire, l’établissement doit justifier <strong>le motif pédagogique et fournir l’autorisation parentale des élèves.</strong></p>"},"rules":[{"name":"formio conditional (structure)","type":"jsonLogic","logic":{"!=":[{"var":"structure"},"École"]},"effects":[{"property":{"target":"hidden","type":"boolean"},"boolean":true}]}]},{"type":"output","dataType":"void","id":"content","name":"Content","configs":{"uid":"fio-12","key":"content1","content":"<p>Le laissez-passer collectif, délivré par le MSPC, autorise un groupe<strong> à franchir légalement une frontière</strong>, sous conditions de sécurité et d'administration.&nbsp;</p><p>Il faut être majeur, justifier d’un motif valable, et fournir la liste des participants, l’immatriculation du véhicule, l’assurance et le permis du chauffeur.&nbsp;</p><p>Les ONG et entreprises peuvent aussi en faire la demande pour des missions légitimes, <strong>avec une preuve de leur statut légal (agrément ou équivalent).</strong></p>"},"rules":[{"name":"always hidden","type":"jsonLogic","logic":true,"effects":[{"property":{"target":"hidden","type":"boolean"},"boolean":true}]},{"name":"Logic","type":"javaScript","code":"const data = dataMap;\nconst row = dataMap;\nlet result = false;\nresult = (data.structure === \"Groupes de citoyens\") || (data.structure === \"Associations\") || (data.structure === \"ONG\");\n\nreturn result === true;","effects":[{"property":{"target":"hidden","type":"boolean"},"boolean":false}]}]}]}]},{"type":"panel","id":"column","name":"Column","configs":{"uid":"fio-13","key":"fio-14"},"children":[{"type":"panel","id":"group","name":"Frais d'étude et timbre","configs":{"uid":"fio-15","key":"coutDeLaDemande","label":"Frais d'étude et timbre"},"children":[{"type":"input","dataType":"number","id":"number","name":"Number","configs":{"uid":"fio-16","key":"cout","label":"Coût","defaultValue":500,"step":"any","disabled":true,"suffix":"F CFA"}}]}]}]}]},{"type":"panel","id":"group","name":"INFORMATION SUR LE DEMANDEUR ","configs":{"uid":"fio-17","key":"informatiinformation_sur_le_demandeuron_Sur_Le_Demandeur","label":"INFORMATION SUR LE DEMANDEUR "},"children":[{"type":"panel","id":"group","name":"Informations personnelles","configs":{"uid":"fio-18","key":"informations_personnelles","label":"Informations personnelles"},"children":[{"type":"panel","id":"row","name":"Row","configs":{"uid":"fio-19","key":"columns18"},"children":[{"type":"panel","id":"column","name":"Column","configs":{"uid":"fio-20","key":"fio-21"},"children":[{"type":"input","dataType":"string","id":"text","name":"Text","configs":{"uid":"fio-22","key":"nom_du_demandeur","label":"Nom du demandeur","defaultValue":null},"validations":[{"validator":"required"}]}]},{"type":"panel","id":"column","name":"Column","configs":{"uid":"fio-23","key":"fio-24"},"children":[{"type":"input","dataType":"string","id":"text","name":"Text","configs":{"uid":"fio-25","key":"prenoms_du_demandeur","label":"Prénoms du demandeur","defaultValue":null},"validations":[{"validator":"required"}]}]},{"type":"panel","id":"column","name":"Column","configs":{"uid":"fio-26","key":"fio-27"},"children":[{"type":"input","dataType":"string","id":"radio","name":"Radio","configs":{"uid":"fio-28","key":"sexe_du_demandeur","label":"Sexe du demandeur","defaultValue":null,"optionsSource":"static","options":[{"label":"Masculin","value":"M"},{"label":"Féminin","value":"F"}]},"validations":[{"validator":"required"}]}]}]},{"type":"panel","id":"row","name":"Row","configs":{"uid":"fio-29","key":"columns4"},"children":[{"type":"panel","id":"column","name":"Column","configs":{"uid":"fio-30","key":"fio-31"},"children":[{"type":"input","dataType":"string","id":"date","name":"Date","configs":{"uid":"fio-32","key":"date_de_naissance_du_demandeur","label":"Date de naissance du demandeur"},"validations":[{"validator":"required"}]}]},{"type":"panel","id":"column","name":"Column","configs":{"uid":"fio-33","key":"fio-34"},"children":[{"type":"input","dataType":"string","id":"text","name":"Text","configs":{"uid":"fio-35","key":"lieu_de_naissance_du_demandeur","label":"Lieu de naissance du demandeur","defaultValue":null},"validations":[{"validator":"required"}]}]},{"type":"panel","id":"column","name":"Column","configs":{"uid":"fio-36","key":"fio-37"},"children":[{"type":"input","dataType":"string","id":"select","name":"Select","configs":{"uid":"fio-38","key":"nationalite_du_demandeur","label":"Nationalité du demandeur","defaultValue":{"code":"TG","label":"Togo"},"optionsSource":"static","options":"Togo\nAfghanistan\nAfrique du Sud\nAlbanie\nAlgérie\nAllemagne\nAndorre\nAngola\nAnguilla\nAntarctique\nAntigua-et-Barbuda\nArabie saoudite\nArgentine\nArménie\nAruba\nAustralie\nAutriche\nAzerbaïdjan\nBahamas\nBahreïn\nBangladesh\nBarbade\nBélarus\nBelgique\nBelize\nBénin\nBermudes\nBhoutan\nBolivie\nBosnie-Herzégovine\nBotswana\nBrésil\nBrunéi Darussalam\nBulgarie\nBurkina Faso\nBurundi\nCambodge\nCameroun\nCanada\nCap-Vert\nCeuta et Melilla\nChili\nChine\nChypre\nColombie\nComores\nCongo-Brazzaville\nCorée du Nord\nCorée du Sud\nCosta Rica\nCroatie\nCuba\nCuraçao\nCôte d'Ivoire\nDanemark\nDiego Garcia\nDjibouti\nDominique\nÉgypte\nSalvador\nÉmirats arabes unis\nÉquateur\nÉrythrée\nEspagne\nEstonie\nÉtats-Unis\nÉthiopie\nFidji\nFinlande\nFrance\nGabon\nGambie\nGéorgie\nGéorgie du Sud et îles Sandwich du Sud\nGhana\nGibraltar\nGrèce\nGrenade\nGroenland\nGuadeloupe\nGuam\nGuatemala\nGuernesey\nGuinée\nGuinée équatoriale\nGuinée-Bissau\nGuyana\nGuyane française\nHaïti\nHonduras\nHongrie\nÎle Christmas\nÎle de l'Ascension\nÎle de Man\nÎle Norfolk\nÎles Åland\nÎles Caïmans\nÎles Canaries\nÎles Cocos\nÎles Cook\nÎles Féroé\nÎles Heard et McDonald\nÎles Malouines\nÎles Mariannes du Nord\nÎles Marshall\nÎles mineures éloignées des États-Unis\nÎles Salomon\nÎles Turks et Caïques\nÎles Vierges britanniques\nÎles Vierges des États-Unis\nInde\nIndonésie\nIrak\nIran\nIrlande\nIslande\nIsraël\nItalie\nJamaïque\nJapon\nJersey\nJordanie\nKazakhstan\nKenya\nKirghizistan\nKiribati\nKosovo\nKoweït\nLa Réunion\nLaos\nLesotho\nLettonie\nLiban\nLibéria\nLibye\nLiechtenstein\nLituanie\nLuxembourg\nMacao R.A.S.\nMadagascar\nMalaisie\nMalawi\nMaldives\nMali\nMalte\nMaroc\nMartinique\nMaurice\nMauritanie\nMayotte\nMexique\nMicronésie\nMoldavie\nMonaco\nMongolie\nMonténégro\nMontserrat\nMozambique\nMyanmar (Birmanie)\nNamibie\nNauru\nNépal\nNicaragua\nNiger\nNigéria\nNiue\nNorvège\nNouvelle-Calédonie\nNouvelle-Zélande\nOman\nOuganda\nOuzbékistan\nPakistan\nPalaos\nTerritoire palestinien\nPanama\nPapouasie-Nouvelle-Guinée\nParaguay\nPays-Bas\nPérou\nPhilippines\nPitcairn\nPologne\nPolynésie française\nPorto Rico\nPortugal\nQatar\nR.A.S. chinoise de Hong Kong\nR.A.S. chinoise de Macao\nRépublique centrafricaine\nRépublique démocratique du Congo\nRépublique dominicaine\nRépublique tchèque\nRoumanie\nRoyaume-Uni\nRussie\nRwanda\nSahara occidental\nSaint-Barthélémy\nSaint-Kitts-et-Nevis\nSaint-Marin\nSaint-Martin (partie française)\nSaint-Pierre-et-Miquelon\nSaint-Vincent-et-les Grenadines\nSainte-Hélène\nSainte-Lucie\nSamoa\nSamoa américaines\nSao Tomé-et-Principe\nSénégal\nSerbie\nSeychelles\nSierra Leone\nSingapour\nSint Maarten\nSlovaquie\nSlovénie\nSomalie\nSoudan\nSoudan du Sud\nSri Lanka\nSuède\nSuisse\nSuriname\nSvalbard et Jan Mayen\nSwaziland\nSyrie\nTadjikistan\nTaïwan\nTanzanie\nTchad\nTerres australes françaises\nTerritoire britannique de l'océan Indien\nTerritoire palestinien\nThaïlande\nTimor oriental\nTokelau\nTonga\nTrinité-et-Tobago\nTristan da Cunha\nTunisie\nTurkménistan\nTurquie\nTuvalu\nUkraine\nUruguay\nVanuatu\nVenezuela\nViet Nam\nWallis-et-Futuna\nYémen\nZambie\nZimbabwe"},"validations":[{"validator":"required"}]}]}]},{"type":"panel","id":"row","name":"Row","configs":{"uid":"fio-39","key":"columns19"},"children":[{"type":"panel","id":"column","name":"Column","configs":{"uid":"fio-40","key":"fio-41"},"children":[{"type":"input","dataType":"string","id":"text","name":"Text","configs":{